{
  "schema_version": "profitability_execution_economics_model.v1",
  "model_id": "peem-profitability-v1",
  "created_at": "2026-06-06T18:30:00+00:00",
  "parent_issue": "#3032",
  "fee_model": {
    "basis": "STATIC_RESEARCH_ASSUMPTION",
    "maker_bps": 2.0,
    "taker_bps": 4.0,
    "status_if_unknown": "WARNING"
  },
  "spread_model": {
    "basis": "OBSERVED_REPLAY_PROXY",
    "measurement_unit": "BPS",
    "applies_to_entry_and_exit": true,
    "status_if_unknown": "FAIL"
  },
  "slippage_model": {
    "basis": "ARVP_SCENARIO_PROXY",
    "input_sources": [
      "SCENARIO_RESULTS",
      "REPLAY_COMPARE"
    ],
    "quantity_sensitive": true,
    "status_if_unknown": "FAIL"
  },
  "cost_attribution": {
    "gross_return_required": true,
    "net_return_required": true,
    "cost_fields": [
      "fees",
      "spread_cost",
      "slippage_cost",
      "other_friction_cost"
    ],
    "ranking_dependency": "#3040"
  },
  "evidence_integration": {
    "evidence_packet_ref": "docs/contracts/profitability_evidence_packet.v1.schema.json",
    "assessment_ref": "docs/contracts/profitability_execution_economics_assessment.v1.schema.json",
    "net_fields_required_before_ranking": true
  },
  "incomplete_assumption_policy": {
    "warning_conditions": [
      "fee source estimated but bounded",
      "spread proxy available only for subset of runs"
    ],
    "fail_conditions": [
      "net return cannot be reconstructed from gross return and cost fields",
      "slippage assumption missing for candidate comparison"
    ],
    "blocked_conditions": [
      "gross return missing",
      "dataset quality blocked",
      "candidate evidence packet missing"
    ]
  },
  "limitations": [
    "Research-only economics model; no runtime fee routing is implied.",
    "League Table stays downstream in #3040."
  ]
}
